{
  "$schema": "https://json-schema.org/draft/2020-12/schema",
  "$id": "urn:areneon:schema:contracts:v1:training-run-config",
  "title": "TrainingRunConfig",
  "description": "The configuration record of one training run (ADR-010 section 5): seeds, generation size, model sizes, PPO settings and the worker's limits. Reviewed JSON in the repository, validated fail-closed and referenced only by the SHA-256 of its JCS bytes (CheckpointRecord.run_config_hash). Sizes and hyperparameters live here, never in code. League mixture and freeze-interval settings are added with the league scheduler (Wave 5).",
  "type": "object",
  "additionalProperties": false,
  "required": [
    "schema_version",
    "lineage_id",
    "format_id",
    "seeds",
    "model",
    "generation",
    "ppo",
    "learner"
  ],
  "properties": {
    "schema_version": {
      "const": 1
    },
    "lineage_id": {
      "description": "Label of the lineage the run trains; every CheckpointRecord of the run carries it.",
      "type": "string",
      "pattern": "^[A-Za-z0-9][A-Za-z0-9._:-]{0,127}$"
    },
    "format_id": {
      "description": "The Showdown format the games are played in.",
      "type": "string",
      "pattern": "^[a-z0-9]+$"
    },
    "seeds": {
      "description": "Every seed of the run. None is a default: a run is identified by this record's hash.",
      "type": "object",
      "additionalProperties": false,
      "required": [
        "run_key",
        "init_preview",
        "init_battle",
        "learner"
      ],
      "properties": {
        "run_key": {
          "description": "Names the run in the battle seeds, the team draws and each Episode's collection record.",
          "type": "string",
          "pattern": "^[A-Za-z0-9][A-Za-z0-9._:-]{0,127}$"
        },
        "init_preview": {
          "description": "Seed of the Preview network's random initialisation.",
          "type": "integer",
          "minimum": 0,
          "maximum": 9007199254740991
        },
        "init_battle": {
          "description": "Seed of the Battle network's random initialisation.",
          "type": "integer",
          "minimum": 0,
          "maximum": 9007199254740991
        },
        "learner": {
          "description": "Seed of the learner's own generator (minibatch order).",
          "type": "integer",
          "minimum": 0,
          "maximum": 9007199254740991
        }
      }
    },
    "model": {
      "description": "Network sizes (ADR-010 section 3): configuration, never code constants. d_model must be a multiple of n_heads (a reader rule).",
      "type": "object",
      "additionalProperties": false,
      "required": [
        "encoder",
        "d_model",
        "n_layers",
        "n_heads",
        "d_ff"
      ],
      "properties": {
        "encoder": {
          "$ref": "#/$defs/Encoder"
        },
        "d_model": {
          "description": "Token width.",
          "type": "integer",
          "minimum": 1,
          "maximum": 4096
        },
        "n_layers": {
          "description": "Transformer blocks.",
          "type": "integer",
          "minimum": 1,
          "maximum": 64
        },
        "n_heads": {
          "description": "Attention heads.",
          "type": "integer",
          "minimum": 1,
          "maximum": 64
        },
        "d_ff": {
          "description": "Feed-forward width.",
          "type": "integer",
          "minimum": 1,
          "maximum": 16384
        }
      }
    },
    "generation": {
      "description": "What one generation plays (ADR-010 section 1).",
      "type": "object",
      "additionalProperties": false,
      "required": [
        "games",
        "baseline_games",
        "excluded_abilities",
        "max_turns",
        "n_parallel",
        "latency_budget_ms",
        "handshake_timeout_ms",
        "max_line_bytes"
      ],
      "properties": {
        "games": {
          "description": "Self-play games per generation: the frozen pair against itself.",
          "type": "integer",
          "minimum": 1,
          "maximum": 65536
        },
        "baseline_games": {
          "description": "Games against scripted baselines, at most one entry per actor (a reader rule).",
          "type": "array",
          "maxItems": 2,
          "items": {
            "$ref": "#/$defs/Baseline"
          }
        },
        "excluded_abilities": {
          "description": "Teams with a set holding any of these abilities are not drawn. A stop-gap for a known gap of the log-to-state reducer (Illusion's replace line, follow-up #851); a value of this record, not of the code, so it goes when the gap does.",
          "type": "array",
          "maxItems": 256,
          "items": {
            "type": "string",
            "minLength": 1,
            "maxLength": 64
          }
        },
        "max_turns": {
          "description": "Turns after which the engine forces a tie.",
          "type": "integer",
          "minimum": 1,
          "maximum": 1000
        },
        "n_parallel": {
          "description": "Battles played at once against one worker.",
          "type": "integer",
          "minimum": 1,
          "maximum": 256
        },
        "latency_budget_ms": {
          "$ref": "#/$defs/Budget"
        },
        "handshake_timeout_ms": {
          "description": "How long the worker may take to answer the hello.",
          "type": "integer",
          "minimum": 1,
          "maximum": 3600000
        },
        "max_line_bytes": {
          "description": "Longest line of the worker protocol.",
          "type": "integer",
          "minimum": 1,
          "maximum": 1073741824
        }
      }
    },
    "ppo": {
      "description": "PPO with GAE (ADR-010 section 1). Real-valued settings are integers in millionths (_micro) or billionths (_nano), because contracts carry no floating-point numbers.",
      "type": "object",
      "additionalProperties": false,
      "required": [
        "epochs",
        "minibatch_size",
        "learning_rate_micro",
        "discount_micro",
        "gae_lambda_micro",
        "clip_micro",
        "value_coef_micro",
        "entropy_coef_micro",
        "max_grad_norm_micro",
        "adam_beta1_micro",
        "adam_beta2_micro",
        "adam_eps_nano",
        "normalize_advantages"
      ],
      "properties": {
        "epochs": {
          "description": "Passes over the generation's TrainingSet.",
          "type": "integer",
          "minimum": 1,
          "maximum": 64
        },
        "minibatch_size": {
          "description": "Decisions per optimiser step.",
          "type": "integer",
          "minimum": 1,
          "maximum": 65536
        },
        "learning_rate_micro": {
          "description": "Adam step size, in millionths.",
          "type": "integer",
          "minimum": 1,
          "maximum": 1000000
        },
        "discount_micro": {
          "description": "Discount gamma, in millionths.",
          "type": "integer",
          "minimum": 0,
          "maximum": 1000000
        },
        "gae_lambda_micro": {
          "description": "GAE lambda, in millionths.",
          "type": "integer",
          "minimum": 0,
          "maximum": 1000000
        },
        "clip_micro": {
          "description": "PPO ratio clip epsilon, in millionths.",
          "type": "integer",
          "minimum": 1,
          "maximum": 1000000
        },
        "value_coef_micro": {
          "description": "Weight of the value loss, in millionths.",
          "type": "integer",
          "minimum": 0,
          "maximum": 10000000
        },
        "entropy_coef_micro": {
          "description": "Weight of the entropy bonus, in millionths.",
          "type": "integer",
          "minimum": 0,
          "maximum": 10000000
        },
        "max_grad_norm_micro": {
          "description": "Gradient-norm clip bound, in millionths.",
          "type": "integer",
          "minimum": 1,
          "maximum": 1000000000
        },
        "adam_beta1_micro": {
          "description": "Adam beta1, in millionths.",
          "type": "integer",
          "minimum": 0,
          "maximum": 999999
        },
        "adam_beta2_micro": {
          "description": "Adam beta2, in millionths.",
          "type": "integer",
          "minimum": 0,
          "maximum": 999999
        },
        "adam_eps_nano": {
          "description": "Adam epsilon, in billionths.",
          "type": "integer",
          "minimum": 1,
          "maximum": 1000000000
        },
        "normalize_advantages": {
          "description": "Normalise advantages to zero mean and unit deviation within each role's batch.",
          "type": "boolean"
        }
      }
    },
    "team_dataset": {
      "description": "Optional (a minor change within v1): the generated team dataset the generation loop draws its teams from. Absent means the interim pool of committed fixture teams. The directory is read by the dataset reader, which trusts nothing; the pool takes the dev and training splits, never validation. The dataset hash pins the manifest and every record: a directory that hashes differently is refused.",
      "type": "object",
      "additionalProperties": false,
      "required": [
        "path",
        "dataset_hash"
      ],
      "properties": {
        "path": {
          "description": "The dataset directory, relative to the directory the generation process runs in (the repository root for the loop driver) or absolute.",
          "type": "string",
          "minLength": 1,
          "maxLength": 1024
        },
        "dataset_hash": {
          "description": "SHA-256 of the JCS of {manifest_hash, splits: {dev, validation, training}}: the dataset manifest's own hash and, per split, the sorted record_hash list of the records the reader verified (empty training list for the committed layout). A swapped, added or removed record changes it.",
          "type": "string",
          "pattern": "^[0-9a-f]{64}$"
        }
      }
    },
    "learner": {
      "description": "Where the learner runs (ADR-010 section 4). A cuda run is not claimed to be bit-reproducible, and its hash differs from a cpu run's.",
      "type": "object",
      "additionalProperties": false,
      "required": [
        "device",
        "threads"
      ],
      "properties": {
        "device": {
          "description": "cpu, or cuda from the separate GPU environment (ADR-010 section 5.2); a missing device is refused, never replaced.",
          "enum": [
            "cpu",
            "cuda"
          ]
        },
        "threads": {
          "description": "Intra-op threads of the learner on cpu.",
          "type": "integer",
          "minimum": 1,
          "maximum": 256
        }
      }
    }
  },
  "$defs": {
    "Encoder": {
      "description": "Feature widths and scales of the encoder (ADR-010 section 3); part of encoder_version.",
      "type": "object",
      "additionalProperties": false,
      "required": [
        "volatile_buckets",
        "condition_buckets",
        "max_moves",
        "max_team",
        "max_picks",
        "stat_scale",
        "turn_scale"
      ],
      "properties": {
        "volatile_buckets": {
          "description": "Buckets for volatile-status features.",
          "type": "integer",
          "minimum": 1,
          "maximum": 4096
        },
        "condition_buckets": {
          "description": "Buckets for field-condition features.",
          "type": "integer",
          "minimum": 1,
          "maximum": 4096
        },
        "max_moves": {
          "description": "Moves per Pokemon the encoder holds.",
          "type": "integer",
          "minimum": 1,
          "maximum": 16
        },
        "max_team": {
          "description": "Pokemon per side the encoder holds.",
          "type": "integer",
          "minimum": 1,
          "maximum": 16
        },
        "max_picks": {
          "description": "Team Preview positions an order names; at most max_team (a reader rule).",
          "type": "integer",
          "minimum": 1,
          "maximum": 16
        },
        "stat_scale": {
          "description": "Divisor of a Pokemon's exact stats.",
          "type": "integer",
          "minimum": 1,
          "maximum": 1000000
        },
        "turn_scale": {
          "description": "Divisor of the turn counter.",
          "type": "integer",
          "minimum": 1,
          "maximum": 1000000
        }
      }
    },
    "Budget": {
      "description": "Per-decision compute limits of self-play, in milliseconds.",
      "type": "object",
      "additionalProperties": false,
      "required": [
        "preview_ms",
        "battle_ms"
      ],
      "properties": {
        "preview_ms": {
          "description": "Team Preview decision.",
          "type": "integer",
          "minimum": 1,
          "maximum": 3600000
        },
        "battle_ms": {
          "description": "Battle decision.",
          "type": "integer",
          "minimum": 1,
          "maximum": 3600000
        }
      }
    },
    "Baseline": {
      "description": "A share of the generation's games played against a scripted baseline (ADR-010 section 4). The baseline's seat never trains the policy.",
      "type": "object",
      "additionalProperties": false,
      "required": [
        "actor",
        "policy_id",
        "games"
      ],
      "properties": {
        "actor": {
          "description": "Which scripted baseline plays.",
          "enum": [
            "actor-rule",
            "random-legal"
          ]
        },
        "policy_id": {
          "description": "The baseline's policy id, <name>@<commit>, as its Episodes record it.",
          "type": "string",
          "pattern": "^[a-z0-9][a-z0-9._-]*@[A-Za-z0-9._-]+$"
        },
        "games": {
          "description": "Games per generation against it.",
          "type": "integer",
          "minimum": 1,
          "maximum": 65536
        }
      }
    }
  }
}
