{"format_id":"gen9championsvgc2026regmc","generation":{"baseline_games":[{"actor":"random-legal","games":1,"policy_id":"random-legal@v1"},{"actor":"actor-rule","games":1,"policy_id":"actor-rule@v1"}],"excluded_abilities":["Illusion"],"games":3,"handshake_timeout_ms":60000,"latency_budget_ms":{"battle_ms":30000,"preview_ms":30000},"max_line_bytes":4000000,"max_turns":4,"n_parallel":2},"learner":{"device":"cpu","threads":1},"lineage_id":"public-fixture","model":{"d_ff":32,"d_model":16,"encoder":{"condition_buckets":4,"max_moves":4,"max_picks":4,"max_team":6,"stat_scale":500,"turn_scale":100,"volatile_buckets":4},"n_heads":2,"n_layers":1},"ppo":{"adam_beta1_micro":900000,"adam_beta2_micro":999000,"adam_eps_nano":10,"clip_micro":200000,"discount_micro":1000000,"entropy_coef_micro":10000,"epochs":2,"gae_lambda_micro":950000,"learning_rate_micro":1000,"max_grad_norm_micro":500000,"minibatch_size":16,"normalize_advantages":true,"value_coef_micro":500000},"schema_version":1,"seeds":{"init_battle":12,"init_preview":11,"learner":13,"run_key":"inspector-fixture"}}
